{
  "$schema": "https://json-schema.org/draft/2020-12/schema",
  "$id": "https://agentlens.dev/schemas/agentlens.event.v1.json",
  "$comment": "v1 is locked. Breaking changes require v2 namespace. v1-unification (S1.5.1, R2) extends event type from a fixed enum to a namespace pattern: reserved AgentLens core namespaces keep their fixed event-name enum; skill and importer namespaces (kws-*, claude.*, codex.*, etc.) accept any lower-case dotted token.",
  "title": "agentlens.event.v1",
  "type": "object",
  "additionalProperties": false,
  "required": ["schema", "event_id", "run_id", "ts", "type", "payload"],
  "properties": {
    "schema": {
      "type": "string",
      "const": "agentlens.event.v1"
    },
    "event_id": {
      "type": "string",
      "pattern": "^evt_[a-z0-9]{12}$"
    },
    "run_id": {
      "type": "string"
    },
    "ts": {
      "type": "string",
      "pattern": "^\\d{4}-\\d{2}-\\d{2}T\\d{2}:\\d{2}:\\d{2}(\\.\\d+)?Z$"
    },
    "type": {
      "type": "string",
      "allOf": [
        {
          "$comment": "General namespace pattern: <namespace>.<event> in lower-kebab/snake. At least one dot required; segments start with a lower-case letter.",
          "pattern": "^[a-z][a-z0-9_-]*(\\.[a-z][a-z0-9_-]*)+$"
        },
        {
          "$comment": "Reserved AgentLens core namespaces must use the locked event-name enum. Skill (e.g. kws-cme.*, kws-cpe.*) and importer (claude.*, codex.*) namespaces are intentionally not constrained beyond the general pattern.",
          "if": {
            "pattern": "^(run|command|checkpoint|artifact|task|failure|recording|agentlens)\\."
          },
          "then": {
            "enum": [
              "run.started",
              "checkpoint.marked",
              "command.started",
              "command.finished",
              "artifact.attached",
              "task.started",
              "task.finished",
              "failure.observed",
              "run.finalized",
              "run.cancelled"
            ]
          }
        }
      ]
    },
    "payload": {
      "type": "object"
    }
  }
}
